{
  "schema_version": "singleaxis.fabric.assurance-finding/v1",
  "finding_id": "finding.review.0000",
  "record_version": 2,
  "run_id": "run.incident-review.0000",
  "lifecycle_stage": "incident",
  "source_type": "human_review",
  "subject": {
    "kind": "incident_record",
    "digest": "1010101010101010101010101010101010101010101010101010101010101010",
    "reference": "evidence://incidents/INC-2026-0042/initial-record",
    "agent_id": "agent.support.v1",
    "agent_version": "1.8.0",
    "deployment_id": "deployment.prod.eu.0042",
    "execution_id": null,
    "decision_id": "decision.01J62INCIDENT001",
    "incident_id": "incident.INC-2026-0042",
    "trace_id": null,
    "span_id": null
  },
  "versions": {"rubric_version": null, "suite_version": null, "policy_version": "incident-review/10"},
  "result": {"outcome": "inconclusive", "severity": "none", "score": null, "confidence": null, "confidence_basis": "not_reported", "reason_code": "evidence.incomplete"},
  "evaluator_provenance": {
    "evaluator_id": "evaluator.incident-review-board",
    "evaluator_version": "10.0.0",
    "artifact_digest": "2020202020202020202020202020202020202020202020202020202020202020",
    "execution_mode": "human",
    "model": null,
    "principal_ref": "principal.reviewer-group.0042"
  },
  "evidence_references": [
    {"evidence_id": "evidence.review-record.0000", "type": "review_record", "digest": "3030303030303030303030303030303030303030303030303030303030303030", "reference": "evidence://incidents/INC-2026-0042/initial-review"}
  ],
  "timestamps": {"run_started_at": "2026-08-25T10:30:00Z", "observed_at": "2026-08-25T10:45:00Z", "finalized_at": "2026-08-25T10:50:00Z", "status_changed_at": "2026-08-25T11:30:00Z"},
  "status": "superseded",
  "appeal": null,
  "supersedes_finding_id": null,
  "superseded_by_finding_id": "finding.review.0001"
}
