{
  "schema_version": "singleaxis.fabric.assurance-finding/v1",
  "finding_id": "finding.judge.0001",
  "record_version": 1,
  "run_id": "run.continuous.20260825.0001",
  "lifecycle_stage": "runtime_continuous",
  "source_type": "llm_judge",
  "subject": {
    "kind": "trace_projection",
    "digest": "1111111111111111111111111111111111111111111111111111111111111111",
    "reference": "trace://0123456789abcdef0123456789abcdef/projection/judge-v4",
    "agent_id": "agent.support.v1",
    "agent_version": "1.8.0",
    "deployment_id": "deployment.prod.eu.0042",
    "execution_id": "execution.01J62RUNTIME0001",
    "decision_id": "decision.01J62RUNTIME0001",
    "incident_id": null,
    "trace_id": "0123456789abcdef0123456789abcdef",
    "span_id": "0123456789abcdef"
  },
  "versions": {"rubric_version": "faithfulness/4.1.0", "suite_version": null, "policy_version": "continuous-assurance/7"},
  "result": {"outcome": "fail", "severity": "medium", "score": 0.31, "confidence": 0.72, "confidence_basis": "heuristic", "reason_code": "faithfulness.below_threshold"},
  "evaluator_provenance": {
    "evaluator_id": "evaluator.faithfulness-judge",
    "evaluator_version": "4.1.0",
    "artifact_digest": "2222222222222222222222222222222222222222222222222222222222222222",
    "execution_mode": "model",
    "model": {
      "provider": "approved-provider",
      "model_id": "judge-model-enterprise",
      "model_version": "2026-08-01",
      "configuration_digest": "3333333333333333333333333333333333333333333333333333333333333333"
    },
    "principal_ref": null
  },
  "evidence_references": [
    {"evidence_id": "evidence.trace-projection.0001", "type": "trace_projection", "digest": "4444444444444444444444444444444444444444444444444444444444444444", "reference": "evidence://prod/execution-0001/judge-projection"},
    {"evidence_id": "evidence.eval-record.0001", "type": "evaluation_record", "digest": "5555555555555555555555555555555555555555555555555555555555555555", "reference": "evidence://prod/execution-0001/evaluation"}
  ],
  "timestamps": {"run_started_at": "2026-08-25T09:00:00Z", "observed_at": "2026-08-25T09:00:05Z", "finalized_at": "2026-08-25T09:00:07Z", "status_changed_at": "2026-08-25T09:00:07Z"},
  "status": "final",
  "appeal": null,
  "supersedes_finding_id": null,
  "superseded_by_finding_id": null
}
