{
  "schema_version": "singleaxis.fabric.assurance-finding/v1",
  "finding_id": "finding.review.0001",
  "record_version": 2,
  "run_id": "run.incident-review.0001",
  "lifecycle_stage": "incident",
  "source_type": "human_review",
  "subject": {
    "kind": "incident_record",
    "digest": "abcdabcdabcdabcdabcdabcdabcdabcdabcdabcdabcdabcdabcdabcdabcdabcd",
    "reference": "evidence://incidents/INC-2026-0042/record",
    "agent_id": "agent.support.v1",
    "agent_version": "1.8.0",
    "deployment_id": "deployment.prod.eu.0042",
    "execution_id": "execution.01J62INCIDENT001",
    "decision_id": "decision.01J62INCIDENT001",
    "incident_id": "incident.INC-2026-0042",
    "trace_id": "abcdefabcdefabcdefabcdefabcdefab",
    "span_id": "abcdefabcdefabcd"
  },
  "versions": {"rubric_version": "incident-causality/2.0", "suite_version": null, "policy_version": "incident-review/11"},
  "result": {"outcome": "fail", "severity": "high", "score": null, "confidence": null, "confidence_basis": "not_reported", "reason_code": "approval_boundary.not_enforced"},
  "evaluator_provenance": {
    "evaluator_id": "evaluator.incident-review-board",
    "evaluator_version": "11.0.0",
    "artifact_digest": "dddddddddddddddddddddddddddddddddddddddddddddddddddddddddddddddd",
    "execution_mode": "human",
    "model": null,
    "principal_ref": "principal.reviewer-group.0042"
  },
  "evidence_references": [
    {"evidence_id": "evidence.review-record.0001", "type": "review_record", "digest": "eeeeeeeeeeeeeeeeeeeeeeeeeeeeeeeeeeeeeeeeeeeeeeeeeeeeeeeeeeeeeeee", "reference": "evidence://incidents/INC-2026-0042/review"},
    {"evidence_id": "evidence.policy-record.0001", "type": "policy_record", "digest": "ffffffffffffffffffffffffffffffffffffffffffffffffffffffffffffffff", "reference": "evidence://incidents/INC-2026-0042/policy"}
  ],
  "timestamps": {"run_started_at": "2026-08-25T11:00:00Z", "observed_at": "2026-08-25T11:20:00Z", "finalized_at": "2026-08-25T11:30:00Z", "status_changed_at": "2026-08-25T12:00:00Z"},
  "status": "appealed",
  "appeal": {"appeal_id": "appeal.INC-2026-0042.01", "filed_at": "2026-08-25T12:00:00Z", "grounds_code": "context.incomplete"},
  "supersedes_finding_id": null,
  "superseded_by_finding_id": null
}
